20221111;Pedro Alvarez;Masculino;Veterinario;15/04/1985;Calle de la Salud 123;+5491161234567;09:00 - 17:00;True
20222222;Ana López;Femenino;Veterinaria especializada en felinos;25/12/1990;Av. de los Gatos 456;+5491162345678;10:00 - 18:00;True
20233333;Carlos Ramirez;Masculino;Veterinario especializado en caninos;05/06/1988;Calle Canina 789;+5491163456789;08:00 - 16:00;True
20244444;Sofía Martínez;Femenino;Veterinaria general;14/02/1992;Calle de los Animales 321;+5491164567890;11:00 - 19:00;False
20255555;Jorge Torres;Masculino;Veterinario cirujano;30/10/1980;Av. de la Medicina 654;+5491165678901;07:00 - 15:00;True
20266666;Carlos;masculino;veterinario;18/03/1987;palermo;+54 1192703492;12:00 - 19:00;True
